code,category,date,time_start,time_end,location
2460,住宅竊盜,2019-01-26,14,16,臺北市大安區龍雲里復興南路2段125巷20弄1~30號
2461,住宅竊盜,2019-01-27,08,10,臺北市中山區林森北路119巷1~30號
2462,住宅竊盜,2019-01-27,18,20,臺北市中正區忠勤里中華路2段315巷31~60號
2463,住宅竊盜,2019-01-30,14,16,臺北市文山區萬芳里004鄰萬芳路1~30號
2464,住宅竊盜,2019-01-31,08,10,臺北市大安區龍生里瑞安街276巷1~30號
2465,住宅竊盜,2019-02-02,06,08,臺北市內湖區內湖路2段179巷35弄1~30號
2466,住宅竊盜,2019-02-02,14,16,臺北市南港區研究院路2段34巷1~30號
2467,住宅竊盜,2019-02-03,04,06,臺北市南港區舊莊里舊莊街1段199巷11弄1~30號
2468,住宅竊盜,2019-02-03,06,08,臺北市大安區建安里20鄰忠孝東路4段205巷7弄1~30號
2469,住宅竊盜,2019-02-04,14,16,臺北市大同區哈密街59巷56弄31~60號
2470,住宅竊盜,2019-02-04,18,20,臺北市中正區永昌里16鄰詔安街241~270號
2471,住宅竊盜,2019-02-04,18,20,臺北市士林區天祿里中山北路6段754巷1~30號
2472,住宅竊盜,2019-02-05,22,24,臺北市中山區新生北路2段113巷31~60號
2473,住宅竊盜,2019-02-06,18,20,臺北市南港區中研里研究院路2段61巷4弄1~30號
2474,住宅竊盜,2019-02-08,14,16,臺北市松山區光復南路22巷10弄1~30號
2475,住宅竊盜,2019-02-08,16,18,臺北市北投區清江里大興街121~150號
2476,住宅竊盜,2019-02-08,18,20,臺北市南港區中研里研究院路2段61巷4弄1~30號
2477,住宅竊盜,2019-02-09,08,10,臺北市中山區新生北路2段91~120號
2478,住宅竊盜,2019-02-09,20,22,臺北市萬華區西藏路121~150號
2479,住宅竊盜,2019-02-11,00,02,臺北市中山區林森北路85巷31~60號
2480,住宅竊盜,2019-02-11,20,22,臺北市中山區民權東路2段1~30號
2481,住宅竊盜,2019-02-12,02,04,臺北市士林區社新里社子街125巷1~30號
2482,住宅竊盜,2019-02-12,06,08,臺北市士林區福華里和豐街33巷1~30號
2483,住宅竊盜,2019-02-12,10,12,臺北市中山區林森北路85巷31~60號
2484,住宅竊盜,2019-02-12,14,16,臺北市大安區光信里仁愛路4段391~420號
2485,住宅竊盜,2019-02-14,00,02,臺北市士林區福佳里文林路587巷91~120號
2486,住宅竊盜,2019-02-14,12,14,臺北市大安區正聲里光復南路308巷1~30號
2487,住宅竊盜,2019-02-14,16,18,臺北市文山區景行里4鄰羅斯福路6段455巷1~30號
2488,住宅竊盜,2019-02-14,18,20,臺北市南港區成福里成福路31~60號
2489,住宅竊盜,2019-02-14,20,22,臺北市萬華區西園路2段281巷1~30號
2490,住宅竊盜,2019-02-15,02,04,臺北市信義區國業里松德路25巷1~30號
2491,住宅竊盜,2019-02-15,12,14,臺北市文山區華興里016鄰辛亥路6段31~60號
2492,住宅竊盜,2019-02-17,08,10,臺北市北投區關渡里知行路293巷15之1~30號
2493,住宅竊盜,2019-02-18,18,20,臺北市萬華區萬大路486巷11弄31~60號
2494,住宅竊盜,2019-02-21,08,10,臺北市中山區錦州街1~30號
2495,住宅竊盜,2019-02-22,08,10,臺北市內湖區新明路451巷1~30號
2496,住宅竊盜,2019-02-22,10,12,臺北市萬華區梧州街31~60號
2497,住宅竊盜,2019-02-22,16,18,臺北市信義區松友里虎林街241~270號
2498,住宅竊盜,2019-02-23,14,16,臺北市內湖區內湖路2段253巷61~90號
2499,住宅竊盜,2019-02-26,04,06,臺北市萬華區西園路1段282巷1~30號
2500,住宅竊盜,2019-02-26,20,22,臺北市南港區新光里昆陽街171巷3弄1~30號
2501,住宅竊盜,2019-02-27,10,12,臺北市北投區中央里大業路280巷9弄1~30號
2502,住宅竊盜,2019-02-27,18,20,臺北市北投區溫泉里民族街43巷1~30號
2503,住宅竊盜,2019-03-03,04,06,臺北市大安區芳和里樂業街65巷1~30號
2504,住宅竊盜,2019-03-03,18,20,臺北市北投區中心里珠海路1~30號
2505,住宅竊盜,2019-03-05,14,16,臺北市文山區萬興里027鄰新光路1段65巷91~120號
2506,住宅竊盜,2019-03-05,18,20,臺北市中正區忠勤里中華路2段307巷31~60號
2507,住宅竊盜,2019-03-06,08,10,臺北市中正區忠勤里中華路2段307巷31~60號
2508,住宅竊盜,2019-03-06,18,20,臺北市北投區稻香里新興路64巷1~30號
2509,住宅竊盜,2019-03-06,20,22,臺北市士林區福中里12鄰通河東街1段130巷1~30號
2510,住宅竊盜,2019-03-07,12,14,臺北市內湖區內湖路一段361~390號
2511,住宅竊盜,2019-03-10,12,14,臺北市萬華區中華路1段181~210號
2512,住宅竊盜,2019-03-11,00,02,臺北市北投區永明里石牌路2段99巷31~60號
2513,住宅竊盜,2019-03-12,12,14,臺北市萬華區西園路1段72巷1~30號
2514,住宅竊盜,2019-03-13,00,02,臺北市中山區士商路15﹑17號
2515,住宅竊盜,2019-03-13,00,02,臺北市士林區士商路15﹑17號
2516,住宅竊盜,2019-03-13,04,06,臺北市中山區樂群二路30巷30弄31~60號
2517,住宅竊盜,2019-03-13,04,06,臺北市中山區民權東路2段1~30號
2518,住宅竊盜,2019-03-13,18,20,臺北市士林區社子里社中街152巷1~30號
2519,住宅竊盜,2019-03-14,16,18,臺北市內湖區康寧路3段189巷157弄1~30號
2520,住宅竊盜,2019-03-14,20,22,臺北市大同區長安西路172巷3弄1~30號
2521,住宅竊盜,2019-03-15,20,22,臺北市中山區合江街116巷1~30號
2522,住宅竊盜,2019-03-16,10,12,臺北市士林區葫蘆里8鄰延平北路5段211~240號
2523,住宅竊盜,2019-03-18,12,14,臺北市士林區社新里19鄰社子街22巷47弄1~30號
2524,住宅竊盜,2019-03-19,00,02,臺北市大安區古莊里雲和街3~10號
2525,住宅竊盜,2019-03-19,14,16,臺北市北投區永和里行義路154巷1~30號
2526,住宅竊盜,2019-03-19,18,20,臺北市信義區興隆里逸仙路26巷1~30號
2527,住宅竊盜,2019-03-21,16,18,臺北市士林區福德里基河路241~270號
2528,住宅竊盜,2019-03-22,08,10,臺北市大安區大學里溫州街74巷3弄1~30號
2529,住宅竊盜,2019-03-22,14,16,臺北市南港區九如里研究院路2段211~240號
2530,住宅竊盜,2019-03-27,14,16,臺北市士林區新安里莊頂路172巷31~60號
2531,住宅竊盜,2019-03-28,00,02,臺北市中山區重新路1段91~120號
2532,住宅竊盜,2019-03-29,02,04,臺北市內湖區康寧路1段86巷2弄1~30號
2533,住宅竊盜,2019-03-30,14,16,臺北市大同區錦西街65巷1~30號
2534,住宅竊盜,2019-03-31,18,20,臺北市中山區北安路551巷1~30號
2535,住宅竊盜,2019-03-31,20,22,臺北市大安區芳和里樂業街94巷1~30號
2536,住宅竊盜,2019-04-01,08,10,臺北市松山區復興北路1~30號
2537,住宅竊盜,2019-04-04,04,06,臺北市松山區三民路107巷1~30號
2538,住宅竊盜,2019-04-07,10,12,臺北市大安區通安里通安街31~60號
2539,住宅竊盜,2019-04-08,10,12,臺北市大同區重慶北路2段57巷1~30號
2540,住宅竊盜,2019-04-08,14,16,臺北市大安區誠安里忠孝東路3段241~270號
2541,住宅竊盜,2019-04-09,10,12,臺北市士林區德華里文林路661巷1~30號
2542,住宅竊盜,2019-04-10,18,20,臺北市北投區永欣里石牌路2段315巷16弄1~30號
2543,住宅竊盜,2019-04-11,14,16,臺北市北投區奇岩里公?路91~120號
2544,住宅竊盜,2019-04-12,02,04,臺北市大安區法治里通化街181~210號
2545,住宅竊盜,2019-04-12,04,06,臺北市中山區民權東路2段135巷1~30號
2546,住宅竊盜,2019-04-12,16,18,臺北市松山區延壽街31~60號
2547,住宅竊盜,2019-04-13,10,12,臺北市內湖區民權東路90巷6弄1~30號
2548,住宅竊盜,2019-04-13,10,12,臺北市中山區德惠街3巷1~30號
2549,住宅竊盜,2019-04-17,02,04,臺北市大安區龍泉里15鄰泰順街40巷1~30號
2550,住宅竊盜,2019-04-17,12,14,臺北市萬華區貴陽街2段82巷1~30號
2551,住宅竊盜,2019-04-19,04,06,臺北市士林區福華里和豐街39巷1~30號
2552,住宅竊盜,2019-04-19,16,18,臺北市士林區名山里忠誠路一段1~30號
2553,住宅竊盜,2019-04-19,16,18,臺北市北投區奇岩里公館路121~150號
2554,住宅竊盜,2019-04-19,16,18,臺北市文山區景慶里萬慶街13巷1~30號
2555,住宅竊盜,2019-04-20,12,14,臺北市中山區向善街87巷1~30號
2556,住宅竊盜,2019-04-22,14,16,臺北市中山區新生北路2段91~120號
2557,住宅竊盜,2019-04-23,04,06,臺北市大安區和安里建國南路1段291巷1~30號
2558,住宅竊盜,2019-04-23,10,12,臺北市信義區景勤里吳興街220巷11弄1~30號
2559,住宅竊盜,2019-04-24,12,14,臺北市中山區復興北路211~240號
2560,住宅竊盜,2019-04-25,10,12,臺北市北投區稻香里石仙路1巷3弄1~30號
2561,住宅竊盜,2019-04-26,20,22,臺北市中山區復興北路211~240號
2562,住宅竊盜,2019-04-27,20,22,臺北市大安區通安里通化街170巷1~30號
2563,住宅竊盜,2019-04-29,02,04,臺北市中山區民權東路2段92巷8弄1~30號
2564,住宅竊盜,2019-04-29,12,14,臺北市北投區立農里吉利街259巷31~60號
2565,住宅竊盜,2019-05-01,10,12,臺北市內湖區內湖路3段331~360號
2566,住宅竊盜,2019-05-02,06,08,臺北市大安區錦華里13鄰羅斯福路2段31~60號
2567,住宅竊盜,2019-05-06,14,16,臺北市北投區奇岩里三合街1段61~90號
2568,住宅竊盜,2019-05-06,20,22,臺北市北投區榮華里振興街31~60號
2569,住宅竊盜,2019-05-07,06,08,臺北市北投區石牌路2段325巷1~30號
2570,住宅竊盜,2019-05-07,22,24,臺北市松山區南京東路3段303巷8弄1~30號
2571,住宅竊盜,2019-05-08,02,04,臺北市中山區德惠街121~150號
2572,住宅竊盜,2019-05-10,10,12,臺北市文山區景仁里景仁街61~90號
2573,住宅竊盜,2019-05-10,16,18,臺北市士林區社新里社子街97巷1~30號
2574,住宅竊盜,2019-05-10,22,24,臺北市中山區民生西路45巷5弄1~30號
2575,住宅竊盜,2019-05-11,04,06,臺北市中山區林森北路85巷61~90號
2576,住宅竊盜,2019-05-11,06,08,臺北市大同區酒泉街9巷11~13號
2577,住宅竊盜,2019-05-12,02,04,臺北市大同區延平北路3段104巷1~30號
2578,住宅竊盜,2019-05-13,02,04,臺北市南港區九如里研究院路3段20巷1~30號
2579,住宅竊盜,2019-05-13,12,14,臺北市中山區中山北路2段59巷44弄1~30號
2580,住宅竊盜,2019-05-13,14,16,臺北市南港區新富里富康街3巷1~30號
2581,住宅竊盜,2019-05-15,08,10,臺北市信義區松友里信義路6段76巷8弄61~90號
2582,住宅竊盜,2019-05-15,12,14,臺北市大安區古莊里師大路114巷
2583,住宅竊盜,2019-05-15,22,24,臺北市信義區永吉路511~540號
2584,住宅竊盜,2019-05-16,02,04,臺北市南港區新富里富康街3巷1~30號
2585,住宅竊盜,2019-05-16,12,14,臺北市士林區明勝里承德路4段2巷(士林區承德路四段2巷上)
2586,住宅竊盜,2019-05-16,12,14,臺北市中山區八德路2段174巷15弄16之1~30號
2587,住宅竊盜,2019-05-16,14,16,臺北市中山區林森北路107巷1~30號
2588,住宅竊盜,2019-05-16,18,20,臺北市北投區一德里中央北路4段583巷1~30號
2589,住宅竊盜,2019-05-19,02,04,臺北市士林區後港里19鄰大南路408巷1~30號
2590,住宅竊盜,2019-05-21,12,14,臺北市北投區一德里大度路3段300巷1~30號
2591,住宅竊盜,2019-05-24,12,14,臺北市文山區明義里012鄰興隆路4段107巷31~60號
2592,住宅竊盜,2019-05-24,20,22,臺北市大同區歸綏街97巷1~30號
2593,住宅竊盜,2019-05-25,08,10,臺北市大安區古莊里007鄰浦城街16巷1~30號
2594,住宅竊盜,2019-05-26,16,18,臺北市中山區德惠街167巷1~30號
2595,住宅竊盜,2019-05-27,00,02,臺北市中山區松江路133巷18之1~30號
2596,住宅竊盜,2019-05-27,12,14,臺北市北投區石牌里致遠一路1段31~60號
2597,住宅竊盜,2019-05-27,20,22,臺北市大安區建倫里敦化南路1段233巷31~60號
2598,住宅竊盜,2019-05-30,10,12,臺北市信義區富台里忠孝東路5段423巷6弄1~30號
2599,住宅竊盜,2019-05-30,10,12,臺北市士林區蘭興里中山北路6段151~180號
2600,住宅竊盜,2019-06-01,18,20,臺北市文山區萬有里7鄰興隆路1段202巷1~30號
2601,住宅竊盜,2019-06-01,20,22,臺北市北投區開明里永興路2段33巷12弄1~30號
2602,住宅竊盜,2019-06-02,04,06,臺北市士林區葫東里葫東街1~30號
2603,住宅竊盜,2019-06-02,06,08,臺北市士林區陽明里華岡路31~60號
2604,住宅竊盜,2019-06-03,04,06,臺北市北投區秀山里中和街502巷3弄1~30號
2605,住宅竊盜,2019-06-04,04,06,臺北市大同區環河北路2段237巷1~30號
2606,住宅竊盜,2019-06-04,12,14,臺北市南港區新光里忠孝東路6段391~420號
2607,住宅竊盜,2019-06-06,04,06,臺北市中山區中山北路2段77巷17之1~30號
2608,住宅竊盜,2019-06-06,08,10,臺北市萬華區萬大路329巷1~30號
2609,住宅竊盜,2019-06-08,14,16,臺北市中正區臨沂街33巷
2610,住宅竊盜,2019-06-08,16,18,臺北市大安區通化里光復南路692巷4弄1~30號
2611,住宅竊盜,2019-06-08,22,24,臺北市萬華區桂林路1~30號
2612,住宅竊盜,2019-06-10,02,04,臺北市士林區葫蘆里1鄰延平北路5段163巷1~30號
2613,住宅竊盜,2019-06-10,16,18,臺北市中正區永昌里詔安街234巷8弄1~30號
2614,住宅竊盜,2019-06-10,18,20,臺北市中山區新生北路2段72巷1~30號
2615,住宅竊盜,2019-06-10,20,22,臺北市北投區建民里文林北路60巷1~30號
2616,住宅竊盜,2019-06-13,08,10,臺北市信義區四維里虎林街74巷1~30號
2617,住宅竊盜,2019-06-14,06,08,臺北市北投區中心里中山路31~60號
2618,住宅竊盜,2019-06-14,20,22,臺北市內湖區康寧里16鄰康寧路3段75巷24弄31~60號
2619,住宅竊盜,2019-06-15,10,12,臺北市萬華區中華路2段661~690號
2620,住宅竊盜,2019-06-16,04,06,臺北市大同區迪化街2段241~270號
2621,住宅竊盜,2019-06-16,06,08,臺北市中正區龍光里12鄰重慶南路3段16巷1~30號
2622,住宅竊盜,2019-06-16,14,16,臺北市萬華區富民路145巷35弄1~30號
2623,住宅竊盜,2019-06-16,18,20,臺北市大同區承德路3段208巷1~30號
2624,住宅竊盜,2019-06-17,18,20,臺北市信義區三張里松勤街121~150號
2625,住宅竊盜,2019-06-19,06,08,臺北市大安區建安里敦化南路1段177巷31~60號
2626,住宅竊盜,2019-06-20,02,04,臺北市內湖區內湖路3段329巷4弄1~30號
2627,住宅竊盜,2019-06-22,16,18,臺北市松山區民生東路5段137巷6弄31~60號
2628,住宅竊盜,2019-06-24,06,08,臺北市萬華區德昌街185巷1~30號
2629,住宅竊盜,2019-06-25,16,18,臺北市北投區關渡里知行路202巷1~30號
2630,住宅竊盜,2019-06-26,18,20,臺北市北投區泉源里登山路1~30號
2631,住宅竊盜,2019-06-27,16,18,臺北市大同區大龍街1~30號
2632,住宅竊盜,2019-06-28,06,08,臺北市中正區黎明里重慶南路1段31~60號
2633,住宅竊盜,2019-06-29,00,02,臺北市文山區萬盛里萬盛街156巷1~30號
2634,住宅竊盜,2019-06-29,14,16,臺北市南港區萬福里忠孝東路6段70巷5弄31~60號
2635,住宅竊盜,2019-06-30,08,10,臺北市中正區永功里詔安街57巷1~30號
2636,住宅竊盜,2019-07-02,06,08,臺北市信義區嘉興里基隆路2段121~150號
2637,住宅竊盜,2019-07-03,02,04,臺北市萬華區環河南路2段100巷1~30號
2638,住宅竊盜,2019-07-03,12,14,臺北市士林區天祿里13鄰中山北路6段754巷1~30號
2639,住宅竊盜,2019-07-03,16,18,臺北市北投區奇岩里公館路166巷1弄1~30號
2640,住宅竊盜,2019-07-03,16,18,臺北市大安區光武里大安路1段52巷1~30號
2641,住宅竊盜,2019-07-03,22,24,臺北市內湖區東湖路113巷31~60號
2642,住宅竊盜,2019-07-04,18,20,臺北市北投區豐年里豐年路2段91~120號
2643,住宅竊盜,2019-07-05,00,02,臺北市中山區復興南路1段30巷1~30號
2644,住宅竊盜,2019-07-07,02,04,臺北市中正區頂東里晉江街48巷1~30號
2645,住宅竊盜,2019-07-07,02,04,臺北市中正區頂東里羅斯福路3段84巷1~30號
2646,住宅竊盜,2019-07-07,04,06,臺北市信義區永吉路225巷1~30號
2647,住宅竊盜,2019-07-07,16,18,臺北市北投區立農里立農街1段257巷1~30號
2648,住宅竊盜,2019-07-08,12,14,臺北市士林區永倫里延平北路6段451~480號
2649,住宅竊盜,2019-07-09,02,04,臺北市文山區萬盛里22鄰興隆路1段55巷1~30號
2650,住宅竊盜,2019-07-09,06,08,臺北市士林區社新里社子街97巷1~30號
2651,住宅竊盜,2019-07-09,10,12,臺北市內湖區文德路22巷53弄31~60號
2652,住宅竊盜,2019-07-09,18,20,臺北市北投區豐年里中央北路2段113巷1~30號
2653,住宅竊盜,2019-07-09,20,22,臺北市大安區古莊里羅斯福路2段81巷1~30號
2654,住宅竊盜,2019-07-10,10,12,臺北市文山區樟新里009鄰樟新街15巷1~30號
2655,住宅竊盜,2019-07-10,10,12,臺北市南港區南港里南港路1段137巷1~30號
2656,住宅竊盜,2019-07-11,18,20,臺北市大同區延平北路1段31~60號
2657,住宅竊盜,2019-07-12,22,24,臺北市萬華區梧州街1~30號
2658,住宅竊盜,2019-07-13,20,22,臺北市文山區忠順里016鄰忠順街2段85巷1弄1~30號
2659,住宅竊盜,2019-07-14,06,08,臺北市大安區昌隆里忠孝東路3段217巷3弄6~3號
2660,住宅竊盜,2019-07-16,14,16,臺北市南港區鴻福里玉成街181巷1~30號
2661,住宅竊盜,2019-07-16,16,18,臺北市北投區中央北路1段1~30號
2662,住宅竊盜,2019-07-17,16,18,臺北市北投區開明里復興四路8巷1~30號
2663,住宅竊盜,2019-07-17,16,18,臺北市松山區南京東路3段65巷331~360號
2664,住宅竊盜,2019-07-18,10,12,臺北市萬華區艋舺大道391~420號
2665,住宅竊盜,2019-07-18,16,18,臺北市內湖區內湖路1段737巷1~30號
2666,住宅竊盜,2019-07-19,02,04,臺北市萬華區環河南路2段280巷31~60號
2667,住宅竊盜,2019-07-20,16,18,臺北市士林區蘭雅里中山北路6段290巷31~60號
2668,住宅竊盜,2019-07-21,02,04,臺北市萬華區雙和街31巷9弄15~1號
2669,住宅竊盜,2019-07-21,06,08,臺北市大安區義村里仁愛路3段123巷11弄1~30號
2670,住宅竊盜,2019-07-22,02,04,臺北市松山區富錦街359巷3弄1~30號
2671,住宅竊盜,2019-07-22,22,24,臺北市中山區吉林路343巷1~30號
2672,住宅竊盜,2019-07-22,22,24,臺北市大安區黎和里臥龍街301~330號
2673,住宅竊盜,2019-07-24,00,02,臺北市中正區忠勤里中華路2段311巷31~60號
2674,住宅竊盜,2019-07-24,02,04,臺北市南港區三重里重陽路511~540號
2675,住宅竊盜,2019-07-24,04,06,臺北市萬華區西園路2段372巷101弄1~30號
2676,住宅竊盜,2019-07-24,22,24,臺北市北投區建民里文林北路94巷31~60號
2677,住宅竊盜,2019-07-25,02,04,臺北市中正區螢雪里福州街43巷1~30號
2678,住宅竊盜,2019-07-25,02,04,臺北市中正區龍興里寧波西街153巷1~30號
2679,住宅竊盜,2019-07-26,02,04,臺北市大安區龍泉里師大路59巷1~30號
2680,住宅竊盜,2019-07-26,08,10,臺北市大同區錦西街65巷31~60號
2681,住宅竊盜,2019-07-27,06,08,臺北市士林區後港里4鄰承德路4段277巷91~120號
2682,住宅竊盜,2019-07-27,10,12,臺北市萬華區和平西路3段331~360號
2683,住宅竊盜,2019-07-27,18,20,臺北市松山區東榮里富錦街359巷2弄1~30號
2684,住宅竊盜,2019-07-28,00,02,臺北市萬華區榮德里11鄰武成街92巷1~30號
2685,住宅竊盜,2019-07-28,02,04,臺北市北投區關渡里知行路2巷1~30號
2686,住宅竊盜,2019-07-28,02,04,臺北市萬華區武成街63巷12弄1~30號
2687,住宅竊盜,2019-07-28,04,06,臺北市萬華區東園街86巷1~30號
2688,住宅竊盜,2019-07-28,08,10,臺北市中正區河堤里水源路61~90號
2689,住宅竊盜,2019-07-28,22,24,臺北市萬華區桂林路242巷46弄1~30號
2690,住宅竊盜,2019-07-29,18,20,臺北市大安區華聲里延吉街131巷1弄1~30號
2691,住宅竊盜,2019-07-29,18,20,臺北市北投區稻香里稻香路73巷1~30號
2692,住宅竊盜,2019-07-29,20,22,臺北市中正區黎明里忠孝西路1段61~90號
2693,住宅竊盜,2019-07-29,20,22,臺北市南港區新光里昆陽街171巷3弄1~30號
2694,住宅竊盜,2019-07-30,04,06,臺北市大安區黎孝里和平東路3段308巷31~60號
2695,住宅竊盜,2019-07-30,14,16,臺北市北投區關渡里大度路3段301巷150弄1~30號
2696,住宅竊盜,2019-07-31,22,24,臺北市中山區中山北路1段83巷16之1~30號
2697,住宅竊盜,2019-08-01,00,02,臺北市中山區吉林路241~270號
2698,住宅竊盜,2019-08-01,02,04,臺北市中山區松江路402巷1~30號
2699,住宅竊盜,2019-08-01,02,04,臺北市中山區德惠街193巷1~30號
2700,住宅竊盜,2019-08-01,14,16,臺北市萬華區昆明街211~240號
2701,住宅竊盜,2019-08-05,00,02,臺北市中正區愛國里愛國西路48巷1~30號
2702,住宅竊盜,2019-08-05,02,04,臺北市北投區一德里中央北路4段541巷1~30號
2703,住宅竊盜,2019-08-05,22,24,臺北市松山區延吉街31~60號
2704,住宅竊盜,2019-08-06,12,14,臺北市大安區古風里泰順街62巷1~30號
2705,住宅竊盜,2019-08-08,14,16,臺北市信義區松光里松山路451~480號
2706,住宅竊盜,2019-08-09,02,04,臺北市文山區樟樹里014鄰興隆路4段96巷4弄1~30號
2707,住宅竊盜,2019-08-10,02,04,臺北市南港區舊莊里合順街8巷5弄1~30號
2708,住宅竊盜,2019-08-12,00,02,臺北市士林區菁山里菁山路31~60號
2709,住宅竊盜,2019-08-15,12,14,臺北市萬華區環河南路2段130巷6弄1~30號
2710,住宅竊盜,2019-08-17,16,18,臺北市內湖區內湖路1段591巷11弄1~30號
2711,住宅竊盜,2019-08-18,06,08,臺北市北投區大同里中央北路1段121~150號
2712,住宅竊盜,2019-08-18,12,14,臺北市萬華區西寧南路1~30號
2713,住宅竊盜,2019-08-18,18,20,臺北市中山區長安西路19巷22弄1~30號
2714,住宅竊盜,2019-08-20,08,10,臺北市松山區南京東路5段251巷46弄1~30號
2715,住宅竊盜,2019-08-23,00,02,臺北市萬華區漢口街2段53巷1~30號
2716,住宅竊盜,2019-08-23,14,16,臺北市大安區新龍里瑞安街222巷31~60號
2717,住宅竊盜,2019-08-23,16,18,臺北市松山區八德路4段601~630號
2718,住宅竊盜,2019-08-24,06,08,臺北市中山區合江街49巷1~30號
2719,住宅竊盜,2019-08-24,10,12,臺北市中正區板溪里平西路1段61~90號
2720,住宅竊盜,2019-08-24,10,12,臺北市內湖區內湖路1段91巷24弄1~30號
2721,住宅竊盜,2019-08-24,20,22,臺北市大安區龍泉里龍泉街31~60號
2722,住宅竊盜,2019-08-25,16,18,臺北市大安區民輝里仁愛路3段5巷3弄1~30號
2723,住宅竊盜,2019-08-29,02,04,臺北市中正區文盛里羅斯福路3段244巷9弄1~30號
2724,住宅竊盜,2019-08-29,04,06,臺北市信義區西村里基隆路1段331~360號
2725,住宅竊盜,2019-08-29,14,16,臺北市萬華區桂林路1~30號
2726,住宅竊盜,2019-09-03,16,18,臺北市萬華區貴陽街2段164巷1~30號
2727,住宅竊盜,2019-09-04,04,06,臺北市萬華區頂碩里9鄰莒光路112巷16弄1~30號
2728,住宅竊盜,2019-09-04,18,20,臺北市士林區社新里社子街63巷1~30號
2729,住宅竊盜,2019-09-05,02,04,臺北市文山區木新里019鄰保儀路109巷3弄1~30號
2730,住宅竊盜,2019-09-05,08,10,臺北市大安區群賢里復興南路2段271~300號
2731,住宅竊盜,2019-09-06,10,12,臺北市內湖區成功路4段167巷1~30號
2732,住宅竊盜,2019-09-07,08,10,臺北市萬華區西園路2段320巷36弄1~30號
2733,住宅竊盜,2019-09-07,22,24,臺北市大同區太原路31~60號
2734,住宅竊盜,2019-09-12,16,18,臺北市大安區龍坡里溫州街22巷2~2號
2735,住宅竊盜,2019-09-12,20,22,臺北市南港區合成里忠孝東路6段271~300號
2736,住宅竊盜,2019-09-13,02,04,臺北市文山區萬芳里026鄰萬美街1段1~30號
2737,住宅竊盜,2019-09-15,08,10,臺北市松山區八德路4段601~630號
2738,住宅竊盜,2019-09-17,14,16,臺北市文山區試院里003鄰木柵路1段31~60號
2739,住宅竊盜,2019-09-18,10,12,臺北市北投區稻香里新興路91~120號
2740,住宅竊盜,2019-09-26,12,14,臺北市士林區葫東里重慶北路4段151~180號
2741,住宅竊盜,2019-09-26,20,22,臺北市大安區錦泰里杭州南路2段61巷31~60號
2742,住宅竊盜,2019-09-28,06,08,臺北市大同區歸綏街181~210號
2743,住宅竊盜,2019-10-01,02,04,臺北市大安區新龍里9鄰信義路3段134巷31~60號
2744,住宅竊盜,2019-10-02,18,20,臺北市信義區永吉路278巷58弄1~30號
2745,住宅竊盜,2019-10-05,04,06,臺北市中山區南京東路三段216巷21之1~30號
2746,住宅竊盜,2019-10-05,16,18,臺北市中山區五常街1~30號
2747,住宅竊盜,2019-10-07,08,10,臺北市大安區正聲里光復南路240巷31~60號
2748,住宅竊盜,2019-10-09,16,18,臺北市文山區景慶里溪口街66巷1~30號
2749,住宅竊盜,2019-10-11,22,24,臺北市北投區永和里行義路121~150號
2750,住宅竊盜,2019-10-12,08,10,臺北市士林區聖山里13鄰德行東路190巷30弄1~30號
2751,住宅竊盜,2019-10-12,12,14,臺北市大安區黎和里和平東路3段606巷1~30號
2752,住宅竊盜,2019-10-14,14,16,臺北市內湖區金湖里民權東路6段391~420號
2753,住宅竊盜,2019-10-14,16,18,臺北市中山區龍江路394巷31~60號
2754,住宅竊盜,2019-10-15,08,10,臺北市萬華區莒光路241~270號
2755,住宅竊盜,2019-10-15,10,12,臺北市南港區中南里忠孝東路7段625巷1~30號
2756,住宅竊盜,2019-10-16,00,02,臺北市大安區師大路126巷1~30號
2757,住宅竊盜,2019-10-17,18,20,臺北市大安區民輝里(仁愛路3段5巷5弄1~30號
2758,住宅竊盜,2019-10-18,14,16,臺北市中山區長春路61~90號
2759,住宅竊盜,2019-10-18,16,18,臺北市中山區中山區雙城街28巷1~30號
2760,住宅竊盜,2019-10-18,16,18,臺北市大安區建安里敦化南路1段187巷1~30號
2761,住宅竊盜,2019-10-21,16,18,臺北市中正區螢圃里廈門街147巷1~30號
2762,住宅竊盜,2019-10-24,12,14,臺北市中正區水源里3鄰羅斯福路4段61~90號
2763,住宅竊盜,2019-10-24,18,20,臺北市文山區樟林里022鄰興隆路4段61~90號
