code,category,date,time_start,time_end,location
1,住宅竊盜,2015-01-01,00,02,臺北市文山區萬美里萬寧街1~30號
2,住宅竊盜,2015-01-01,00,02,臺北市信義區富台里忠孝東路5段295巷6弄1~30號
3,住宅竊盜,2015-01-01,06,08,臺北市中山區新生北路1段91~120號
4,住宅竊盜,2015-01-01,10,12,臺北市文山區明興里興隆路4段1~30號
5,住宅竊盜,2015-01-02,00,02,臺北市士林區天福里1鄰忠誠路2段130巷1~30號
6,住宅竊盜,2015-01-02,06,08,臺北市萬華區糖?里大理街159巷1~30號
7,住宅竊盜,2015-01-02,06,08,臺北市萬華區糖?里大理街159巷1~30號
8,住宅竊盜,2015-01-02,10,12,臺北市中山區吉林路121~150號
9,住宅竊盜,2015-01-04,10,12,臺北市信義區五常里永吉路225巷32弄1~30號
10,住宅竊盜,2015-01-04,12,14,臺北市士林區明勝里通河街31~60號
11,住宅竊盜,2015-01-05,00,02,臺北市中山區南京東路3段181~210號
12,住宅竊盜,2015-01-05,04,06,臺北市萬華區大理街159巷1~30號
13,住宅竊盜,2015-01-05,04,06,臺北市萬華區糖?里大理街159巷1~30號
14,住宅竊盜,2015-01-05,12,14,臺北市北投區吉慶里實踐街56巷1~30號
15,住宅竊盜,2015-01-05,16,18,臺北市中正區忠勤里中華路2段311巷1~30號
16,住宅竊盜,2015-01-05,18,20,臺北市文山區興福里12鄰景華街61~90號
17,住宅竊盜,2015-01-06,04,06,臺北市信義區雅祥里基隆路1段1~30號
18,住宅竊盜,2015-01-06,16,18,臺北市中正區水源里汀州路3段91~120號
19,住宅竊盜,2015-01-07,16,18,臺北市文山區萬芳里萬芳路31~60號
20,住宅竊盜,2015-01-08,08,10,臺北市文山區萬美里萬美街1段61~90號
21,住宅竊盜,2015-01-09,10,12,臺北市內湖區港華里港華街1~30號
22,住宅竊盜,2015-01-09,12,14,臺北市中山區樂群二路91~120號
23,住宅竊盜,2015-01-09,16,18,臺北市松山區民權東路3段106巷1~30號
24,住宅竊盜,2015-01-10,04,06,臺北市信義區福德街373巷91~120號
25,住宅竊盜,2015-01-11,08,10,臺北市萬華區萬大路387巷1~30號
26,住宅竊盜,2015-01-12,08,10,臺北市大安區龍雲里4鄰大安路2段132巷1~30號
27,住宅竊盜,2015-01-12,18,20,臺北市松山區光復南路22巷31~60號
28,住宅竊盜,2015-01-12,20,22,臺北市松山區健康路325巷18弄1~30號
29,住宅竊盜,2015-01-13,10,12,臺北市萬華區青年路31~60號
30,住宅竊盜,2015-01-14,08,10,臺北市松山區富錦街572巷1~30號
31,住宅竊盜,2015-01-14,16,18,臺北市萬華區和平西路3段382巷2弄1~30號
32,住宅竊盜,2015-01-15,00,02,臺北市松山區饒河街181~210號
33,住宅竊盜,2015-01-15,06,08,臺北市南港區舊莊街1段290巷1弄1~30號
34,住宅竊盜,2015-01-15,06,08,臺北市南港區九如里研究院路3段18巷1~30號
35,住宅竊盜,2015-01-15,10,12,臺北市內湖區民權東路6段296巷91~120號
36,住宅竊盜,2015-01-15,12,14,臺北市大安區市民大道4段1~30號
37,住宅竊盜,2015-01-16,10,12,臺北市松山區敦化南路2段31~60號
38,住宅竊盜,2015-01-17,08,10,臺北市信義區國業里松德路25巷31~60號
39,住宅竊盜,2015-01-17,12,14,臺北市文山區明義里興隆路4段46巷31~60號
40,住宅竊盜,2015-01-17,18,20,臺北市中正區羅斯福路4段52巷1~30號
41,住宅竊盜,2015-01-17,18,20,臺北市中正區羅斯福路4段52巷1~30號
42,住宅竊盜,2015-01-18,02,04,臺北市萬華區桂林路242巷1~30號
43,住宅竊盜,2015-01-18,06,08,臺北市萬華區西園路2段320巷61~90號
44,住宅竊盜,2015-01-18,10,12,臺北市大安區通化里通化街19巷1~30號
45,住宅竊盜,2015-01-18,20,22,臺北市信義區富台里忠孝東路5段295巷6弄31~60號
46,住宅竊盜,2015-01-19,06,08,臺北市大同區蓬萊里昌吉街50巷1~30號
47,住宅竊盜,2015-01-20,18,20,臺北市南港區三重里重陽路511~540號
48,住宅竊盜,2015-01-21,08,10,臺北市萬華區柳鄉里1鄰桂林路242巷6弄1~30號
49,住宅竊盜,2015-01-21,20,22,臺北市中山區吉林路379巷1~30號
50,住宅竊盜,2015-01-21,20,22,臺北市士林區百齡里21鄰通河東街1段61~90號
51,住宅竊盜,2015-01-21,22,24,臺北市中山區中山北路1段53巷1~30號
52,住宅竊盜,2015-01-22,10,12,臺北市大同區揚雅里承德路3段90巷1~30號
53,住宅竊盜,2015-01-22,16,18,臺北市大安區龍安里青田街5巷1~30號
54,住宅竊盜,2015-01-23,14,16,臺北市中山區北安路571~600號
55,住宅竊盜,2015-01-23,14,16,臺北市中正區龍光里和平西路2段1~30號
56,住宅竊盜,2015-01-23,18,20,臺北市文山區萬興里21鄰秀明路2段115巷1~30號
57,住宅竊盜,2015-01-24,10,12,臺北市萬華區梧州街60巷1~30號
58,住宅竊盜,2015-01-26,02,04,臺北市萬華區民和街55巷1~30號
59,住宅竊盜,2015-01-26,08,10,臺北市大同區酒泉街103巷1~30號
60,住宅竊盜,2015-01-26,18,20,臺北市中正區水源里羅斯福路4段91~120號
61,住宅竊盜,2015-01-26,20,22,臺北市內湖區西康里4鄰文湖街11巷1~30號
62,住宅竊盜,2015-01-27,02,04,臺北市中山區中山北路2段1~30號
63,住宅竊盜,2015-01-27,06,08,臺北市中山區民生東路3段9巷1~30號
64,住宅竊盜,2015-01-27,10,12,臺北市文山區景興路238巷1~30號
65,住宅竊盜,2015-01-27,10,12,臺北市文山區景興路238巷1~30號
66,住宅竊盜,2015-01-27,14,16,臺北市南港區東明里興華路64巷1~30號
67,住宅竊盜,2015-01-27,16,18,臺北市大安區錦泰里15鄰金山南路2段121~150號
68,住宅竊盜,2015-01-27,16,18,臺北市文山區景興路238巷1~30號
69,住宅竊盜,2015-01-28,14,16,臺北市內湖區東湖里康樂街48巷18~1號
70,住宅竊盜,2015-01-29,12,14,臺北市松山區延壽街121~150號
71,住宅竊盜,2015-01-29,12,14,臺北市信義區富台里忠孝東路5段423巷5弄1~30號
72,住宅竊盜,2015-01-30,12,14,臺北市信義區廣居里忠孝東路5段372巷27弄61~90號
73,住宅竊盜,2015-01-31,00,02,臺北市南港區重陽路57巷1~30號
74,住宅竊盜,2015-02-01,00,02,臺北市北投區中心里中和街31~60號
75,住宅竊盜,2015-02-01,10,12,臺北市松山區敦化北路199巷100弄1~30號
76,住宅竊盜,2015-02-01,10,12,臺北市北投區雙全街62巷1~30號
77,住宅竊盜,2015-02-01,18,20,臺北市信義區信義路6段15巷1~30號
78,住宅竊盜,2015-02-02,08,10,臺北市中正區網溪里廈門街91~120號
79,住宅竊盜,2015-02-02,20,22,臺北市北投區中心里中和街31~60號
80,住宅竊盜,2015-02-03,04,06,臺北市文山區木新里木新路2段161巷1~30號
81,住宅竊盜,2015-02-04,18,20,臺北市中山區農安街125巷1~30號
82,住宅竊盜,2015-02-05,02,04,臺北市士林區百齡里福港街211~240號
83,住宅竊盜,2015-02-05,04,06,臺北市內湖區樂康里康樂街111巷31~60號
84,住宅竊盜,2015-02-05,14,16,臺北市萬華區大理街170巷1~30號
85,住宅竊盜,2015-02-06,08,10,臺北市中山區合江街20巷1~30號
86,住宅竊盜,2015-02-06,16,18,臺北市內湖區西湖里內湖路1段285巷69弄91~120號
87,住宅竊盜,2015-02-07,04,06,臺北市信義區黎安里和平東路路3段571~600號
88,住宅竊盜,2015-02-07,22,24,臺北市中正區三愛里新生南路1段121~150號
89,住宅竊盜,2015-02-08,04,06,臺北市大安區新龍里信義路3段134巷91~120號
90,住宅竊盜,2015-02-09,02,04,臺北市文山區忠順里忠順街2段1~30號
91,住宅竊盜,2015-02-10,00,02,臺北市北投區大同路200巷1~30號
92,住宅竊盜,2015-02-10,10,12,臺北市士林區福志里志成路22巷15弄1~30號
93,住宅竊盜,2015-02-11,16,18,臺北市內湖區葫洲里民權東路6段296巷38之1~30號
94,住宅竊盜,2015-02-12,00,02,臺北市萬華區萬大路493巷48弄1~30號
95,住宅竊盜,2015-02-12,02,04,臺北市松山區撫遠街241~270號
96,住宅竊盜,2015-02-12,12,14,臺北市信義區松隆里松山路615巷1~30號
97,住宅竊盜,2015-02-12,20,22,臺北市文山區興安里22鄰景華街176巷7~1號
98,住宅竊盜,2015-02-13,04,06,臺北市中山區八德路2段210巷1~30號
99,住宅竊盜,2015-02-13,08,10,臺北市中山區農安街1~30號
100,住宅竊盜,2015-02-14,08,10,臺北市士林區明勝里承德路4段12巷61~90號
101,住宅竊盜,2015-02-15,08,10,臺北市中山區長安東路2段1~30號
102,住宅竊盜,2015-02-15,08,10,臺北市大安區法治里通化街173巷1~30號
103,住宅竊盜,2015-02-15,12,14,臺北市北投區吉利里20鄰石牌路1段39巷61~90號
104,住宅竊盜,2015-02-15,22,24,臺北市信義區和平東路3段661~690號
105,住宅竊盜,2015-02-16,00,02,臺北市信義區吳興街269巷1~30號
106,住宅竊盜,2015-02-16,12,14,臺北市中正區文盛里羅斯福路3段210巷8弄1~30號
107,住宅竊盜,2015-02-16,14,16,臺北市內湖區新明路246巷3弄1~30號
108,住宅竊盜,2015-02-16,18,20,臺北市內湖區西湖里內湖路1段91巷121~150號
109,住宅竊盜,2015-02-16,22,24,臺北市松山區南京東路5段211~240號
110,住宅竊盜,2015-02-16,22,24,臺北市中山區南京路三民1號
111,住宅竊盜,2015-02-18,06,08,臺北市大同區民權里民權西路160巷30弄1~30號
112,住宅竊盜,2015-02-19,12,14,臺北市信義區黎忠里和平東路3段391巷8弄31~60號
113,住宅竊盜,2015-02-19,18,20,臺北市北投區文林里致遠一路1段125巷1~30號
114,住宅竊盜,2015-02-19,18,20,臺北市信義區四育里虎林街46巷1~30號
115,住宅竊盜,2015-02-19,20,22,臺北市信義區四育里虎林街46巷1~30號
116,住宅竊盜,2015-02-20,06,08,臺北市北投區文林里致遠一路1段31~60號
117,住宅竊盜,2015-02-21,18,20,臺北市大安區通化里17鄰通化街39巷62弄1~30號
118,住宅竊盜,2015-02-22,02,04,臺北市文山區樟新里樟新街32巷1~30號
119,住宅竊盜,2015-02-23,00,02,臺北市士林區義信里大南路61~90號
120,住宅竊盜,2015-02-23,12,14,臺北市南港區中南里中南街74巷31~60號
121,住宅竊盜,2015-02-23,14,16,臺北市信義區大仁里福德街84巷1弄1~30號
122,住宅竊盜,2015-02-23,20,22,臺北市士林區蘭雅里德行東路31~60號
123,住宅竊盜,2015-02-24,12,14,臺北市萬華區萬大路493巷48弄1~30號
124,住宅竊盜,2015-02-24,16,18,臺北市北投區中心里8鄰泉源路31~60號
125,住宅竊盜,2015-02-24,20,22,臺北市內湖區西湖里26鄰內湖路1段285巷65弄61~90號
126,住宅竊盜,2015-02-25,04,06,臺北市中正區黎明里南陽街1~30號
127,住宅竊盜,2015-02-25,08,10,臺北市士林區聖山里忠誠路1段147巷1~30號
128,住宅竊盜,2015-02-25,10,12,臺北市南港區舊莊里舊莊街1段145巷6弄1~30號
129,住宅竊盜,2015-02-26,02,04,臺北市大安區義安里敦化南路2段63巷31~60號
130,住宅竊盜,2015-02-26,14,16,臺北市中正區幸市里臨沂街33巷1~30號
131,住宅竊盜,2015-02-26,20,22,臺北市內湖區西湖里內湖路1段323巷14弄1~30號
132,住宅竊盜,2015-02-27,00,02,臺北市萬華區西寧南路206巷1~30號
133,住宅竊盜,2015-02-27,02,04,臺北市萬華區西園路2段151~180號
134,住宅竊盜,2015-02-27,10,12,臺北市北投區中央里大興街24巷7弄1~30號
135,住宅竊盜,2015-02-28,20,22,臺北市內湖區週美里新明路3800巷4弄1~30號
136,住宅竊盜,2015-02-28,20,22,臺北市萬華區東園街73巷61~90號
137,住宅竊盜,2015-03-02,08,10,臺北市松山區八德路4段106巷6弄1~30號
138,住宅竊盜,2015-03-04,00,02,臺北市北投區福興里自強街5巷61~90號
139,住宅竊盜,2015-03-04,16,18,臺北市士林區社新里延平北路6段273巷1~30號
140,住宅竊盜,2015-03-04,16,18,臺北市內湖區湖興里成功路2段312巷31~60號
141,住宅竊盜,2015-03-05,04,06,臺北市北投區吉慶里11鄰致遠二路1~30號
142,住宅竊盜,2015-03-05,04,06,臺北市萬華區和平西路3段55巷8弄1~30號
143,住宅竊盜,2015-03-05,14,16,臺北市內湖區葫洲里2鄰民權東路6段280巷25弄6之1~30號
144,住宅竊盜,2015-03-06,04,06,臺北市松山區八德路3段121~150號
145,住宅竊盜,2015-03-06,20,22,臺北市大安區建安里忠孝東路4段181巷40弄1~30號
146,住宅竊盜,2015-03-07,04,06,臺北市北投區大同里大業路481~510號
147,住宅竊盜,2015-03-08,16,18,臺北市萬華區內江街151~180號
148,住宅竊盜,2015-03-08,22,24,臺北市萬華區中華路2段416巷1~30號
149,住宅竊盜,2015-03-09,04,06,臺北市文山區萬盛里羅斯福路5段61~90號
150,住宅竊盜,2015-03-10,00,02,臺北市士林區天母里中山北路7段219巷1~30號
151,住宅竊盜,2015-03-10,00,02,臺北市松山區八德路4段106巷10弄1~30號
152,住宅竊盜,2015-03-10,12,14,臺北市萬華區昆明街211~240號
153,住宅竊盜,2015-03-10,12,14,臺北市萬華區昆明街211~240號
154,住宅竊盜,2015-03-11,08,10,臺北市中山區新生北路22段58巷1~30號
155,住宅竊盜,2015-03-12,00,02,臺北市中正區水源里羅斯福路4段61~90號
156,住宅竊盜,2015-03-12,10,12,臺北市大同區至聖里大龍街259巷10弄1~30號
157,住宅竊盜,2015-03-12,16,18,臺北市大安區古莊里浦城街13巷1~30號
158,住宅竊盜,2015-03-13,02,04,臺北市北投區中庸里10鄰大同街181~210號
159,住宅竊盜,2015-03-13,22,24,臺北市中山區松江路37巷1~30號
160,住宅竊盜,2015-03-14,02,04,臺北市文山區試院里和興路91~120號
161,住宅竊盜,2015-03-15,02,04,臺北市萬華區長泰街271~300號
162,住宅竊盜,2015-03-16,02,04,臺北市萬華區中華路1段181~210號
163,住宅竊盜,2015-03-16,08,10,臺北市中正區螢雪里水源路151~180號
164,住宅竊盜,2015-03-17,00,02,臺北市北投區榮華里17鄰明德路118巷1~30號
165,住宅竊盜,2015-03-17,12,14,臺北市南港區萬福里同德路50巷1~30號
166,住宅竊盜,2015-03-19,12,14,臺北市文山區萬和里溪洲街61~90號
167,住宅竊盜,2015-03-19,22,24,臺北市北投區永和里同德街44巷1~30號
168,住宅竊盜,2015-03-20,12,14,臺北市萬華區糖?里大理街160巷26弄1~30號
169,住宅竊盜,2015-03-20,18,20,臺北市松山區南京東路5段23巷7弄1~30號
170,住宅竊盜,2015-03-20,18,20,臺北市萬華區漢口街2段61~90號
171,住宅竊盜,2015-03-24,06,08,臺北市北投區永明里石牌路2段97巷1~30號
172,住宅竊盜,2015-03-24,08,10,臺北市松山區民權東路3段153巷3弄1~30號
173,住宅竊盜,2015-03-24,10,12,臺北市萬華區東園街85巷4弄1~30號
174,住宅竊盜,2015-03-25,12,14,臺北市中正區文祥里金山南路1段79巷1~30號
175,住宅竊盜,2015-03-25,14,16,臺北市大安區龍門里10鄰和平東路2段18巷13弄1~30號
176,住宅竊盜,2015-03-25,22,24,臺北市中山區合江街61~90號
177,住宅竊盜,2015-03-26,16,18,臺北市文山區興福里1鄰興隆路1段260巷1~30號
178,住宅竊盜,2015-03-27,18,20,臺北市文山區萬隆里羅斯福路5段241~270號
179,住宅竊盜,2015-03-27,18,20,臺北市信義區黎平里和平東路3段207巷6弄1~30號
180,住宅竊盜,2015-03-28,10,12,臺北市中山區民權東路3段1~30號
181,住宅竊盜,2015-03-29,08,10,臺北市松山區南京東路5段31~60號
182,住宅竊盜,2015-03-30,08,10,臺北市中山區松江路332﹑334號
183,住宅竊盜,2015-03-30,10,12,臺北市士林區平等里平菁街105巷1~30號
184,住宅竊盜,2015-03-30,12,14,臺北市文山區萬利街2巷1~30號
185,住宅竊盜,2015-03-31,08,10,臺北市內湖區金瑞里金龍路1~30號
186,住宅竊盜,2015-03-31,22,24,臺北市萬華區萬大路493巷28弄1~30號
187,住宅竊盜,2015-04-01,00,02,臺北市中山區長春路241~270號
188,住宅竊盜,2015-04-01,12,14,臺北市士林區新安里新安路241~270號
189,住宅竊盜,2015-04-01,12,14,臺北市士林區天壽里5鄰天母西路22巷1~30號
190,住宅竊盜,2015-04-04,12,14,臺北市文山區木新里指南路1段31~60號
191,住宅竊盜,2015-04-04,20,22,臺北市松山區饒河街61~90號
192,住宅竊盜,2015-04-05,12,14,臺北市文山區指南里指南路3段22巷1~30號
193,住宅竊盜,2015-04-05,20,22,臺北市松山區光復北路31~60號
194,住宅竊盜,2015-04-05,22,24,臺北市內湖區港富里麗山街328巷1~30號
195,住宅竊盜,2015-04-05,22,24,臺北市大同區南芳里延平北路2段241~270號
196,住宅竊盜,2015-04-07,02,04,臺北市萬華區雅江街31~60號
197,住宅竊盜,2015-04-07,10,12,臺北市中山區大直街84巷1~30號
198,住宅竊盜,2015-04-07,10,12,臺北市內湖區紫陽里文德路22巷59弄1~30號
199,住宅竊盜,2015-04-08,12,14,臺北市中正區螢雪里重慶南路3段74巷1~30號
200,住宅竊盜,2015-04-09,10,12,臺北市中山區農安街1~30號
201,住宅竊盜,2015-04-10,06,08,臺北市北投區吉利里23鄰吉利街320巷1弄1~30號
202,住宅竊盜,2015-04-10,16,18,臺北市萬華區忠德里4鄰寶興街91~120號
203,住宅竊盜,2015-04-10,20,22,臺北市松山區民生東路5段181~210號
204,住宅竊盜,2015-04-11,10,12,臺北市內湖區內湖路1段359巷1~30號
205,住宅竊盜,2015-04-13,10,12,臺北市北投區智仁里杏林二路28巷1~30號
206,住宅竊盜,2015-04-13,12,14,臺北市萬華區貴陽街2段151~180號
207,住宅竊盜,2015-04-13,16,18,臺北市大同區永樂里甘谷街1~30號
208,住宅竊盜,2015-04-15,00,02,臺北市萬華區富民里4鄰貴陽街2段151~180號
209,住宅竊盜,2015-04-15,08,10,臺北市松山區民生東路4段55巷1~30號
210,住宅竊盜,2015-04-15,16,18,臺北市萬華區西園路2段261巷31~60號
211,住宅竊盜,2015-04-16,06,08,臺北市文山區萬和里1鄰溪州街137巷61~90號
212,住宅竊盜,2015-04-16,06,08,臺北市士林區三玉里忠誠路2段41巷1~30號
213,住宅竊盜,2015-04-16,12,14,臺北市中山區中山北路2段93巷1~30號
214,住宅竊盜,2015-04-16,14,16,臺北市內湖區康樂街61巷12弄1~30號
215,住宅竊盜,2015-04-16,14,16,臺北市北投區永欣里石牌路2段181~210號
216,住宅竊盜,2015-04-16,20,22,臺北市南港區舊莊里舊莊街1段145巷6弄1~30號
217,住宅竊盜,2015-04-17,18,20,臺北市北投區奇岩里奇岩路31~60號
218,住宅竊盜,2015-04-17,18,20,臺北市中山區建國北路3段22巷1~30號
219,住宅竊盜,2015-04-19,14,16,臺北市北投區榮華里榮華一路15巷1~30號
220,住宅竊盜,2015-04-20,12,14,臺北市內湖區五分街61~90號
221,住宅竊盜,2015-04-20,16,18,臺北市內湖區瑞光里瑞光路235巷1~30號
222,住宅竊盜,2015-04-20,22,24,臺北市中山區遼寧街241~270號
223,住宅竊盜,2015-04-21,18,20,臺北市文山區指南里15鄰指南路3段26巷1~30號
224,住宅竊盜,2015-04-22,18,20,臺北市松山區撫遠街181~210號
225,住宅竊盜,2015-04-22,20,22,臺北市萬華區萬大路493巷12弄1~30號
226,住宅竊盜,2015-04-23,04,06,臺北市內湖區康樂街136巷15弄1~30號
227,住宅竊盜,2015-04-23,08,10,臺北市松山區南京東路5段211~240號
228,住宅竊盜,2015-04-23,14,16,臺北市內湖區樂康里康樂街136巷15弄1~30號
229,住宅竊盜,2015-04-23,18,20,臺北市士林區仁勇里16鄰大東路121~150號
230,住宅竊盜,2015-04-23,20,22,臺北市萬華區環河南路2段250巷3弄1~30號
231,住宅竊盜,2015-04-24,10,12,臺北市內湖區樂康里康樂街72巷17弄121~150號
232,住宅竊盜,2015-04-25,00,02,臺北市大同區揚雅里民族西路151~180號
233,住宅竊盜,2015-04-25,04,06,臺北市文山區興業里23鄰辛亥路5段124巷1~30號
234,住宅竊盜,2015-04-26,04,06,臺北市北投區智仁里21鄰中和街525巷10弄1~30號
235,住宅竊盜,2015-04-27,06,08,臺北市中山區大直街62巷5弄1~30號
236,住宅竊盜,2015-04-27,08,10,臺北市內湖區湖興里20鄰成功路2段250巷31~60號
237,住宅竊盜,2015-04-27,12,14,臺北市文山區興隆路2段154巷1~30號
238,住宅竊盜,2015-04-27,14,16,臺北市中山區大直街62巷5弄1~30號
239,住宅竊盜,2015-04-27,18,20,臺北市萬華區德昌街132巷1~30號
240,住宅竊盜,2015-04-27,22,24,臺北市內湖區港都里港華街85巷1~30號
241,住宅竊盜,2015-04-28,20,22,臺北市萬華區西藏路481~510號
242,住宅竊盜,2015-04-29,12,14,臺北市中山區敬業三路162巷121~150號
243,住宅竊盜,2015-04-29,14,16,臺北市中山區敬業三路162巷31~60號
244,住宅竊盜,2015-04-30,08,10,臺北市內湖區麗山街328巷1~30號
245,住宅竊盜,2015-04-30,18,20,臺北市內湖區樂康里康樂街136巷18弄31~60號
246,住宅竊盜,2015-05-01,00,02,臺北市信義區忠孝東路
247,住宅竊盜,2015-05-01,14,16,臺北市松山區民生東路5段181~210號
248,住宅竊盜,2015-05-01,16,18,臺北市中山區吉林路379巷1~30號
249,住宅竊盜,2015-05-03,00,02,臺北市中山區農安街1~30號
250,住宅竊盜,2015-05-03,12,14,臺北市松山區撫遠街391~420號
251,住宅竊盜,2015-05-03,18,20,臺北市松山區寶清街104巷31~60號
252,住宅竊盜,2015-05-04,10,12,臺北市中山區長安東路1段31~60號
253,住宅竊盜,2015-05-04,18,20,臺北市內湖區西湖里內湖路1段323巷1~30號
254,住宅竊盜,2015-05-05,10,12,臺北市南港區舊莊里舊莊街1段145巷6弄1~30號
255,住宅竊盜,2015-05-05,18,20,臺北市士林區菁山里永公路511~540號
256,住宅竊盜,2015-05-06,20,22,臺北市文山區試院里29鄰木柵路1段1~30號
257,住宅竊盜,2015-05-07,20,22,臺北市信義區大道里大道路7巷1弄1~30號
258,住宅竊盜,2015-05-08,06,08,臺北市大同區斯文里大龍街89巷1~30號
259,住宅竊盜,2015-05-08,08,10,臺北市大安區車層里忠孝東路4段216巷19弄1~30號
260,住宅竊盜,2015-05-08,14,16,臺北市北投區大屯里復興三路521巷1~30號
261,住宅竊盜,2015-05-09,12,14,臺北市士林區聖山里20鄰忠義街46巷1~30號
262,住宅竊盜,2015-05-10,04,06,臺北市大安區虎嘯里樂業街15巷1~30號
263,住宅竊盜,2015-05-10,12,14,臺北市內湖區新明路380巷9弄1~30號
264,住宅竊盜,2015-05-10,14,16,臺北市中山區中山北路1段91~120號
265,住宅竊盜,2015-05-11,22,24,臺北市萬華區萬大路322巷55弄1~30號
266,住宅竊盜,2015-05-12,10,12,臺北市北投區開明里珠海路107巷1~30號
267,住宅竊盜,2015-05-12,12,14,臺北市中正區文祥里金山南路一段91~120號
268,住宅竊盜,2015-05-12,20,22,臺北市松山區延壽街61~90號
269,住宅竊盜,2015-05-13,16,18,臺北市松山區健康路7巷1~30號
270,住宅竊盜,2015-05-13,20,22,臺北市信義區五全里永吉路181~210號
271,住宅竊盜,2015-05-14,10,12,臺北市內湖區康寧路3段245巷31~60號
272,住宅竊盜,2015-05-14,12,14,臺北市文山區樟新里木新路3段301~330號
273,住宅竊盜,2015-05-15,06,08,臺北市萬華區中華路2段481~510號
274,住宅竊盜,2015-05-15,12,14,臺北市內湖區麗山街46巷5弄1~30號
275,住宅竊盜,2015-05-15,12,14,臺北市內湖區康寧路1段156巷7弄1~30號
276,住宅竊盜,2015-05-15,18,20,臺北市北投區榮光里致遠一路2段40巷1弄1~30號
277,住宅竊盜,2015-05-18,12,14,臺北市中正區黎明里信陽街1~30號
278,住宅竊盜,2015-05-18,14,16,臺北市萬華區東園街66巷1~30號
279,住宅竊盜,2015-05-21,18,20,臺北市北投區文化里文化三路1~30號
280,住宅竊盜,2015-05-21,22,24,臺北市士林區福志里24鄰中山北路5段756巷1~30號
281,住宅竊盜,2015-05-22,18,20,臺北市中正區板溪里南昌路2段91~120號
282,住宅竊盜,2015-05-23,10,12,臺北市松山區南京東路5段291巷44弄1~30號
283,住宅竊盜,2015-05-23,10,12,臺北市松山區南京東路5段59巷28弄1~30號
284,住宅竊盜,2015-05-25,20,22,臺北市文山區試院里木柵路1段31~60號
285,住宅竊盜,2015-05-26,06,08,臺北市北投區洲美里洲美街81巷1~30號
286,住宅竊盜,2015-05-26,16,18,臺北市中山區錦州街181~210號
287,住宅竊盜,2015-05-26,22,24,臺北市中山區林森北路119巷1~30號
288,住宅竊盜,2015-05-28,06,08,臺北市文山區萬祥里興隆路1段70巷1~30號
289,住宅竊盜,2015-05-28,20,22,臺北市士林區永倫里6鄰社中街426巷1~30號
290,住宅竊盜,2015-05-29,16,18,臺北市大同區斯文里承德路3段85巷1~30號
291,住宅竊盜,2015-05-29,22,24,臺北市大同區南京西路31~60號
292,住宅竊盜,2015-05-30,10,12,臺北市松山區民生東路5段36巷6弄1~30號
293,住宅竊盜,2015-05-31,22,24,臺北市文山區興得里興隆路3段192巷8弄31~60號
294,住宅竊盜,2015-05-31,22,24,臺北市信義區大道里林口街151~180號
295,住宅竊盜,2015-06-01,00,02,臺北市中山區八德路2段241~270號
296,住宅竊盜,2015-06-02,14,16,臺北市北投區泉源里東昇路91~120號
297,住宅竊盜,2015-06-03,00,02,臺北市中正區光復里7號
298,住宅竊盜,2015-06-03,16,18,臺北市中山區長安東路2段31~60號
299,住宅竊盜,2015-06-04,14,16,臺北市中山區樂群二路181~210號
300,住宅竊盜,2015-06-06,04,06,臺北市中山區錦州街31~60號
301,住宅竊盜,2015-06-06,12,14,臺北市松山區南京東路5段123巷8弄1~30號
302,住宅竊盜,2015-06-06,20,22,臺北市松山區八德路3段12巷52弄1~30號
303,住宅竊盜,2015-06-07,06,08,臺北市中山區中山北路2段65巷2弄1~30號
304,住宅竊盜,2015-06-07,10,12,臺北市中山區農安街125巷1~30號
305,住宅竊盜,2015-06-07,12,14,臺北市大安區民炤里新生南路1段137巷1~30號
306,住宅竊盜,2015-06-08,06,08,臺北市中正區黎明里懷寧街61~90號
307,住宅竊盜,2015-06-08,08,10,臺北市中山區民權東路1段31~60號
308,住宅竊盜,2015-06-08,14,16,臺北市士林區福林里中山北路5段460巷1~30號
309,住宅竊盜,2015-06-08,22,24,臺北市中山區長春路61~90號
310,住宅竊盜,2015-06-09,16,18,臺北市文山區試院里和興路91~120號
311,住宅竊盜,2015-06-11,20,22,臺北市萬華區桂林路242巷31~60號
312,住宅竊盜,2015-06-12,10,12,臺北市信義區三張里莊敬路391~420號
313,住宅竊盜,2015-06-13,12,14,臺北市中山區新生北路3段31~60號
